user_input,retrieved_contexts,response,reference,faithfulness,context_precision,context_recall,chunk_size,chunk_overlap
"Is it safe to get tattoo done at home?, Is there possibility of infection? Is there any risk getting my tattoo done by an Amateur tattoo artist?","['Tattooing – Know the Risks \nPart 4 Summary Offences Act 1953\nSouth Australian Law\nPart 4 Summary Offences Act 1953\n•\tYou must be 18 before you get a tattoo\n•\tParents cannot give consent to a minor  \nbeing tattooed\n•\tYou must take valid photo identification with you \n(which the studio may ask to photocopy for its \nrecords), provide your name and address and sign \na written agreement with the studio\n•\tA tattoo artist has the right to refuse to tattoo you  \nif they are concerned that you may be under 18 \nRisks involved\nContaminated equipment, unclean premises, unsafe \nprocedures and a lack of infection control knowledge \nmay potentially contribute to the spread of various \ninfections. Infections cannot only occur during the \nprocedure, but can also occur if the tattoo isn’t  \ncared for properly afterwards.\nSpecific risks include: \n•\tBlood borne viruses such as hepatitis B, C or HIV\n•\tSkin infections such as Staphylococcus  \naureus (staph)\n•\tAllergic reactions to tattoo ink \n•\tGranulomas – nodules around the tattoo\n•\tKeloid formation – abnormal scar tissue  \n•\tAggravation or flare up of existing skin conditions \ne.g. dermatitis, eczema \n \n \n \n \nDO NOT tattoo yourself or get a ‘home job’ \ndone – amateur tattoos are risky.  \nGo to a professional tattoo artist working in an \nestablished studio. This will reduce your risk of \ngetting an infection. You can also ask the tattooist \nor ring the local council to ask if the studio has been \ninspected by Environmental Health Officers  \nfor compliance with SA Health Guidelines on  \nhealth and safety.', 'Go to a professional tattoo artist working in an \nestablished studio. This will reduce your risk of \ngetting an infection. You can also ask the tattooist \nor ring the local council to ask if the studio has been \ninspected by Environmental Health Officers  \nfor compliance with SA Health Guidelines on  \nhealth and safety. \nA responsible tattoo artist should: \n•\tFreely answer questions about their experience, \ninfection control techniques and tattooing \nprocedures in their studio\n•\tKnow the SA Health Guidelines on the Safe and \nHygienic Practice of Skin Penetration and can talk \nabout it with you\n•\tAsk you about any personal health matters which \ncould indicate that you should not be tattooed\n•\tOutline potential risks, complications and  \nhealing times\n•\tOperate from a clean and tidy, well lit professional \nstudio. The tattoo artists should be clean  \nand tidy too\n•\tUse new disposable equipment or sterilise reusable \nequipment using a functioning bench  \ntop steam steriliser (autoclave)\n•\tOpen sterilised, packaged needles and tubes  \nin front of you. The packaging keeps the item \nsterile until used\n•\tPut inks into clean containers and discard them \nfollowing the procedure \n•\tClean and disinfect the area of skin thoroughly \nbefore tattooing you\nGovernment of South Australia', 'Conclusions: Inappropriate hygiene measures in tattoo parlors and non-medical \nwound care are major risk factors for tattoo-related infections. In addition, \n facultative pathogenic bacterial species can be isolated from tattoo inks in use, \nwhich may pose a serious health risk. \n►Cite this as \nDieckmann R, Boone I, Brockmann SO, Hammerl JA,  \nKolb-Mäurer A,  Goebeler M, Luch A, Al Dahouk S: The risk of bacterial  \ninfection after tattooing—a systematic review of the literature.  \nDtsch Arztebl Int 2016; 113: 665–71.  DOI: 10.3238/arztebl.2016.0665\nB\nody modifications including tattoos are a \n globally growing trend. According to recent sur-\nveys the overall prevalence of tattoos among adults in \nindustrialized countries is around 10–20% (1). Since \nthere are currently no public health reporting require-\nments for infectious complications associated with \n tattooing, the actual incidence and prevalence of infec-\ntions following tattooing remain largely unknown in \nmany countries, which is why scientifically sound risk \nquantification is not possible. \nIn compliance with the International Classification \nof Procedures in Medicine (ICPM) tattooing represents \na surgical procedure with its own Operations and \n Procedures (OPS) code number (5–890.0; see OPS \n version 2015). However, tattooing is almost never \n performed by medical doctors and can therefore not be \nepidemiologically monitored by use of medical data-\nbases. \nA specific diagnosis code for diseases following \nnon-medically indicated cosmetic surgery was intro-\nduced in Germany in 2008. However, this comprises \ndiverse procedures such as a range of aesthetic \n operations, along with tattoos and piercings. Since \nthere is currently no ICD (International Classification \nof Diseases) code that would explicitly and specifically \nassociate infectious diseases with the procedure of \n tattooing, it proved impossible to derive a reliable \n estimate of infection rates from data collected by Ger-\nman health insurance companies.', 'The wound itself can become infected or the body can be systematically infected as \ngerms can enter the bloodstream. Pathogens can enter the wound via non-sterile equipment, \nfrom the skin of the person receiving or applying the tattoo or from contaminated tattooing \nagents. \n \nPersons with immune deficiencies have an increased risk of infection or delayed wound heal-\ning. In the view of the BfR, people under antibiotic or immunosuppressive therapy or with \nother risk factors, as well as persons with heart disease, diabetes or blood clotting disorders, \nshould either refrain completely from tattooing or seek medical advice before doing so. This \nalso applies to expectant mothers. \n \nTo avoid infections, knowledge of and strict compliance with hygiene rules is important. This \napplies not only to the tattooing process itself but also to the type and handling of the tattoo-\ning agents and the after-treatment of the wounds. Professional tattoo artists in Germany \nhave formed umbrella organisations and orientate themselves on their guidelines concerning \nhygiene requirements during tattooing. \n \nThe full version of this BfR Information is available in German on \nhttp://www.bfr.bund.de/cm/343/infektionsrisiken-durch-taetowierungen.pdf \nSeite 1 von 1']","It is not safe to get a tattoo done at home, and amateur tattoos are considered risky. There is a significant possibility of infection, as inappropriate hygiene measures and non-medical wound care are major risk factors. Pathogens can enter the wound through non-sterile equipment, from the skin of the person receiving or applying the tattoo, or from contaminated tattooing agents.

Specific risks associated with tattooing, which are heightened with amateur procedures, include:
*   Blood-borne viruses such as hepatitis B, C, or HIV.
*   Skin infections like Staphylococcus aureus (staph).
*   Allergic reactions to tattoo ink.
*   Granulomas, which are nodules around the tattoo.
*   Keloid formation, an abnormal type of scar tissue.
*   Aggravation or flare-up of existing skin conditions such as dermatitis or eczema.

To reduce the risk of infection, it is recommended to go to a professional tattoo artist working in an established studio.",DO NOT tattoo yourself or get a home job done. Amateur tattoos are risky. Go to a professional tattoo artist working in an established studio. You can also ask the tattooistor ring the local council to ask if the studio has been inspected by Environmental Health Officers for compliance with SA Health Guidelines on health and safety.,1.0,0.999999999975,1.0,512,80
General aftercare advice for a new tattoo? ,"['WW.EADV.ORG\nINFORMATION LEAFLET FOR PATIENTS 2021\n2021 © EADV\n2021 © THE EADV TATTOOS AND BODY ART TASK FORCE\nInformation Leaflet \nfor Patients\nThe aim of this leaflet\nThis leaflet is designed to help you understand more about tattoo aftercare.  \nIt tells you what’s important to do and to avoid, how to understand the \ndifference between normal and abnormal wound healing and what to do when \na problem occurs. \nTattoo aftercare', 'EADV Information Leaflet For Patients I Tattoo & body art: Tattoo Aftercare\nWhat is the source of the \ninfection? \n1. Hygiene: \n• Limit touching the fresh tattoo.\n• Clean hands are crucial to avoid \ninfection. \n• Wash your hands before touching \na fresh tattoo. \n• Ensure clothing that comes into \ncontact with a fresh tattoo and \nduring the healing period is clean.\n• Showering is fine. Use plenty of \nwater and a small amount of soap or \nsoap substitutes. Rinse thoroughly. \n• Dab the tattoo dry with a fresh \nclean towel or kitchen paper or \nallow the tattoo to air dry. Do not \nwipe or rub dry. \n• Do not pick crusts or loose skin \nduring the healing period and avoid \nscratching. \n2. Wound care \nFollow the wound care advice until \nhealing is complete and use only \nappropriate aftercare materials, \naccording to the instructions of your \nprofessional tattooist.\nSome tattooists will apply a plastic \nfoil, polyurethane film bandage or \nsecond-skin like bandage that will be \nused until full healing of the tattoo. \n• The foil or bandage can remain on \nthe wound for 24 hours or even for \nseveral days as long as it feels \ncomfortable without leakage of \nwound fluid. The wound will then \nheal without forming a scab. \n• When leakage of wound fluid occurs, \nthe bandage must be changed.\n• The wound can be washed, dried \nand a new bandage can be applied \nfor a few more days until it peels off \nspontaneously. \n• When the wound is healed, do not \nrecover with a bandage.\nAnother treatment option is frequent \napplication of hypoallergenic after -\ncare ointment. \n• Apply a light film of the ointment two \nor three times daily for 2 or 3\xa0days. \n• Rinse with water or shower between \nbandage changes.\n• Cover the tattoo with a new non-ad-\nhesive dressing. A soft scab will \nstart to cover the tattoo after a few \ndays.', 'When you experience a medical \nproblem contact a physician.\nAlways inform the tattooist. The \ntattooist is advised to keep records of \nany action taken. The tattooist can \ncheck the ICF (informed consent \nform) to identify the materials which \nhave been used for tattooing. This can \nbe helpful to trace the source of the \ninfection or to identify culprit mate -\nrials, including inks in case of allergy.\nHow can you recognize normal versus abnormal signs  \nof wound healing?\nHere you can find a description of normal healing and signs of infection \nand allergy and what to do if infection or allergy is suspected. \nNormal signs \n• The tattoo will be sensitive and \nwarm to the touch for several \nhours or days. The superficial \nlayers of the tattooed skin will \npeel away during the first weeks.\n• Weeping (clear or pink fluid \nmixed with tattoo ink) is normal \nin the first days. In case of exces-\nsive weeping, the bandage will \nget saturated and start to leak. It \nis recommended to change the \ndressing more frequently then. \n• Mild redness in the tattooed area \nis a normal phenomenon but \nshould decrease rapidly in the \nnext few days.\n• Mild swelling is normal in the \nfirst hours or days but will \ndecrease every day. \n• A feverish feeling can occur in \nthe first 12 hours, especially \nwhen large areas have been \ntattooed. This should disappear \nthe next day; if not, monitor \nclosely for infection.\nAbnormal Signs \nHow can you recognize signs of \ninfection? \nSee also leaflet Tattoo infection.\n• Increasing weeping.\n• Discharge of yellowish to green \nsticky fluid.\n• Unpleasant/foul smell. \n• Increasing painful redness, \nspreading around the tattooed \narea.\n• Increasing pain, throbbing and \nburning in and around the tat-\ntooed area.\nThe following alarm signs can \nindicate a severe infection \nwhich can be associated with \nsepticemia (“blood poisoning”) \nand require immediate medical \nattention.', '•\tWash their hands at the beginning and end of  \nthe procedure\n•\tPut on new disposable gloves before starting the \nprocedure and only touch your skin, the needle or \ntattoo machine. A good tattoo artist will change \ngloves many times during your procedure\n•\tDiscuss the aftercare of your tattoo and give  \nyou written aftercare instructions \n•\tEncourage you to return so the healing process \ncan be checked\nThink before you ink!\nA tattoo is permanent so choose carefully and \nthink long-term. Removing a tattoo is a painstaking \nprocess, usually involving several laser treatments \nand considerable expense. Complete removal \nwithout scarring may be impossible.  \nTake good care of your tattoo\nIt is important to ensure that your tattoo heals \nwell without infection. Your personal hygiene, \nemployment and hobbies may affect how well your \ntattoo heals. Your tattoo artist will advise you on the \nbest aftercare to suit your tattoo. Allow up to two \nweeks for healing.\nWhen finished, your tattoo artist will clean the \ntattooed area and may cover it with a bandage. If the \nbandage is especially made to apply after a tattooing \nprocedure then your tattoo artist will tell you when \nto remove it. Plastic wrap is a ‘get home’ cover \nonly and should be removed as soon as possible. \nPlastic wrap does not breathe and so retards the \nhealing process by creating a warm, moist, airless \nenvironment that encourages bacterial growth.  \nAfter the bandage is removed wash your tattoo.  \nGeneral aftercare advice:\n•\tDO wash hands thoroughly before cleaning or \ntouching the tattooed area \n•\tDO keep area clean and dry\n•\tDO wash the tattoo with clean running water and  \na mild liquid soap. Rinse and pat dry preferably  \nwith paper towel\n•\tDO use a cream recommended by your tattoo \nartist and apply it when the skin feels as if it is \ndrying out\n•\tDO get enough sleep and eat a nutritious diet.']","For general aftercare of a new tattoo, it is important to maintain good hygiene and follow specific wound care instructions.

Key advice includes:
*   Wash your hands thoroughly before touching or cleaning the tattooed area.
*   Limit touching the fresh tattoo.
*   Ensure any clothing that comes into contact with the tattoo is clean.
*   Showering is acceptable; use plenty of water and a small amount of mild soap or soap substitute, then rinse thoroughly.
*   After washing, dab the tattoo dry with a fresh, clean towel or kitchen paper, or allow it to air dry. Avoid wiping or rubbing.
*   Keep the tattooed area clean and dry.
*   Do not pick at crusts or loose skin, and avoid scratching during the healing period.
*   If a bandage was applied by the tattoo artist, follow their specific instructions for removal. Plastic wrap should be removed as soon as possible as it can hinder healing.
*   If using an aftercare ointment, apply a light film two or three times daily for 2 or 3 days, or as recommended by your tattoo artist, especially when the skin feels dry.
*   Get enough sleep and maintain a nutritious diet to support healing.",DO wash hands thoroughly before cleaning or touching the tattooed area DO keep area clean and dryDO wash the tattoo with clean running water anda mild liquid soap. Rinse and pat dry preferably with paper towel ,1.0,0.9166666666361111,1.0,512,80
